{
  "schema": "recipe/v1",
  "meta": { "id": "rcp_pilot", "name": "Character short", "version": 7, "registryVersion": "2026.09.1", "updatedAt": "2026-09-29T10:12:00Z" },
  "nodes": [
    { "id": "n_prompt", "type": "input.prompt", "typeVersion": 1, "label": "Scene prompt", "position": { "x": 0, "y": 0 },
      "params": { "text": "A girl in a red coat on a rainy street, cinematic" }, "groupId": "g_1" },
    { "id": "n_img", "type": "image.generate", "typeVersion": 2, "position": { "x": 360, "y": 0 },
      "params": { "model": "auto", "ratio": "9:16", "count": 2 }, "groupId": "g_1" },
    { "id": "n_edit", "type": "image.edit", "typeVersion": 1, "position": { "x": 720, "y": 0 },
      "params": { "mode": "upscale", "scale": 2 }, "groupId": "g_1" },
    { "id": "n_if", "type": "flow.if", "typeVersion": 1, "label": "Portrait?", "position": { "x": 1080, "y": 0 },
      "params": { "field": "meta.height", "op": "gt", "compare": "1000" } },
    { "id": "n_vid", "type": "video.generate", "typeVersion": 2, "position": { "x": 1440, "y": -80 },
      "params": { "model": "auto", "mode": "frames", "duration": 5 } },
    { "id": "n_voice", "type": "audio.generate", "typeVersion": 2, "position": { "x": 1440, "y": 160 },
      "params": { "model": "auto" } },
    { "id": "n_out", "type": "output.export", "typeVersion": 1, "position": { "x": 1800, "y": 0 },
      "params": { "name": "character-short", "format": "mp4" } }
  ],
  "edges": [
    { "id": "e_1", "source": "n_prompt", "sourcePort": "text",  "target": "n_img",   "targetPort": "prompt" },
    { "id": "e_2", "source": "n_img",    "sourcePort": "image", "target": "n_edit",  "targetPort": "image" },
    { "id": "e_3", "source": "n_edit",   "sourcePort": "image", "target": "n_if",    "targetPort": "value" },
    { "id": "e_4", "source": "n_if",     "sourcePort": "then",  "target": "n_vid",   "targetPort": "first" },
    { "id": "e_5", "source": "n_prompt", "sourcePort": "text",  "target": "n_voice", "targetPort": "text" },
    { "id": "e_6", "source": "n_vid",    "sourcePort": "video", "target": "n_out",   "targetPort": "video" },
    { "id": "e_7", "source": "n_voice",  "sourcePort": "audio", "target": "n_out",   "targetPort": "audio" }
  ],
  "groups": [
    { "id": "g_1", "name": "Shot 1 · image", "position": { "x": -20, "y": -60 }, "size": { "w": 1060, "h": 300 } }
  ]
}
